<?xml version="1.0" encoding="UTF-8" standalone="yes"?>
<!--~~~~~~~~~~~~~~~~~~~~~~~~~~~~~~~~~~~~~~~~~~~~~~~~~~~~~~~~~~~~~~~~~~~~~~~~~~~
  ~ JBoss, a division of Red Hat                                              ~
  ~ Copyright 2006, Red Hat Middleware, LLC, and individual                   ~
  ~ contributors as indicated by the @authors tag. See the                    ~
  ~ copyright.txt in the distribution for a full listing of                   ~
  ~ individual contributors.                                                  ~
  ~                                                                           ~
  ~ This is free software; you can redistribute it and/or modify it           ~
  ~ under the terms of the GNU Lesser General Public License as               ~
  ~ published by the Free Software Foundation; either version 2.1 of          ~
  ~ the License, or (at your option) any later version.                       ~
  ~                                                                           ~
  ~ This software is distributed in the hope that it will be useful,          ~
  ~ but WITHOUT ANY WARRANTY; without even the implied warranty of            ~
  ~ MERCHANTABILITY or FITNESS FOR A PARTICULAR PURPOSE. See the GNU          ~
  ~ Lesser General Public License for more details.                           ~
  ~                                                                           ~
  ~ You should have received a copy of the GNU Lesser General Public          ~
  ~ License along with this software; if not, write to the Free               ~
  ~ Software Foundation, Inc., 51 Franklin St, Fifth Floor, Boston, MA        ~
  ~ 02110-1301 USA, or see the FSF site: http://www.fsf.org.                  ~
  ~~~~~~~~~~~~~~~~~~~~~~~~~~~~~~~~~~~~~~~~~~~~~~~~~~~~~~~~~~~~~~~~~~~~~~~~~~~-->

<!DOCTYPE deployments PUBLIC
   "-//JBoss Portal//DTD Portlet Instances 2.6//EN"
   "http://www.jboss.org/portal/dtd/portlet-instances_2_6.dtd">

<deployments>
   <deployment>
      <instance>
         <display-name xml:lang="en">Google Map</display-name>
         <display-name xml:lang="zh">Google地图</display-name>
         <instance-id>GoogleMapPortletInstance</instance-id>
         <portlet-ref>GoogleMap</portlet-ref>
      </instance>
   </deployment>
   <deployment>
      <instance>
         <display-name xml:lang="en">Google Weather</display-name>
         <display-name xml:lang="zh">Google天气</display-name>
         <instance-id>GoogleWeatherPortletInstance</instance-id>
         <portlet-ref>GoogleWeather</portlet-ref>
      </instance>
   </deployment>
   <deployment>
      <instance>
         <display-name xml:lang="en">Remote Controller</display-name>
         <display-name xml:lang="zh">遥控器</display-name>
         <instance-id>RemoteControlPortletInstance</instance-id>
         <portlet-ref>RemoteControl</portlet-ref>
      </instance>
   </deployment>
   <deployment>
      <instance>
         <display-name xml:lang="en">Catalog Portlet</display-name>
         <display-name xml:lang="zh">产品目录Portlet</display-name>
         <instance-id>ShoppingCatalogPortletInstance</instance-id>
         <portlet-ref>ShoppingCatalog</portlet-ref>
      </instance>
   </deployment>
   <deployment>
      <instance>
         <display-name xml:lang="en">Cart Portlet</display-name>
         <display-name xml:lang="zh">购物车Portlet</display-name>
         <instance-id>ShoppingCartPortletInstance</instance-id>
         <portlet-ref>ShoppingCart</portlet-ref>
      </instance>
   </deployment>
</deployments>