<?xml version="1.0" encoding="UTF-8" standalone="yes"?>
<!--~~~~~~~~~~~~~~~~~~~~~~~~~~~~~~~~~~~~~~~~~~~~~~~~~~~~~~~~~~~~~~~~~~~~~~~~~~~
  ~ JBoss, a division of Red Hat                                              ~
  ~ Copyright 2006, Red Hat Middleware, LLC, and individual                   ~
  ~ contributors as indicated by the @authors tag. See the                    ~
  ~ copyright.txt in the distribution for a full listing of                   ~
  ~ individual contributors.                                                  ~
  ~                                                                           ~
  ~ This is free software; you can redistribute it and/or modify it           ~
  ~ under the terms of the GNU Lesser General Public License as               ~
  ~ published by the Free Software Foundation; either version 2.1 of          ~
  ~ the License, or (at your option) any later version.                       ~
  ~                                                                           ~
  ~ This software is distributed in the hope that it will be useful,          ~
  ~ but WITHOUT ANY WARRANTY; without even the implied warranty of            ~
  ~ MERCHANTABILITY or FITNESS FOR A PARTICULAR PURPOSE. See the GNU          ~
  ~ Lesser General Public License for more details.                           ~
  ~                                                                           ~
  ~ You should have received a copy of the GNU Lesser General Public          ~
  ~ License along with this software; if not, write to the Free               ~
  ~ Software Foundation, Inc., 51 Franklin St, Fifth Floor, Boston, MA        ~
  ~ 02110-1301 USA, or see the FSF site: http://www.fsf.org.                  ~
  ~~~~~~~~~~~~~~~~~~~~~~~~~~~~~~~~~~~~~~~~~~~~~~~~~~~~~~~~~~~~~~~~~~~~~~~~~~~-->

<!DOCTYPE deployments PUBLIC
   "-//JBoss Portal//DTD Portlet Instances 2.6//EN"
   "http://www.jboss.org/portal/dtd/portlet-instances_2_6.dtd">

<deployments>
   <deployment>
      <instance>
         <display-name xml:lang="en">RSS portlet JBoss Portal</display-name>
         <display-name xml:lang="fr">Portlet RSS de JBoss Portal</display-name>
         <display-name xml:lang="pt_BR">Portlet de RSS do JBoss Portal</display-name>
         <display-name xml:lang="zh">JBoss门户RSS Portlet</display-name>
         <instance-id>NewsPortletInstance</instance-id>
         <portlet-ref>NewsPortlet</portlet-ref>
      </instance>
   </deployment>
   <deployment>
      <if-exists>overwrite</if-exists>
      <instance>
         <display-name xml:lang="en">RSS portlet Yahoo finance RHT</display-name>
         <display-name xml:lang="fr">Portlet RSS de Yahoo Finance RHT</display-name>
         <display-name xml:lang="pt_BR">Portlet de RSS do Yahoo Finance RHT</display-name>
         <display-name xml:lang="zh">雅虎财经RSS Portlet</display-name>
         <instance-id>NewsPortletInstance2</instance-id>
         <portlet-ref>NewsPortlet</portlet-ref>
         <preferences>
            <preference>
               <name>expires</name>
               <value>180</value>
            </preference>
            <preference>
               <name>RssXml</name>
               <value>http://finance.yahoo.com/rss/headline?s=rht</value>
            </preference>
         </preferences>
      </instance>
   </deployment>
</deployments>